cid,text,time,author,channel,votes,photo,heart,reply,time_parsed
Ugwe75hgQ1JxT1j6RpN4AaABAg.9j6XwoCHnXi9jHTFKYkK9x, @TENTSIO   those are pretty equal,7 days ago,Jake Kilka,UC-FCjNZ0shxV2NXRRXuLPlQ,0,https://yt3.ggpht.com/ytc/AMLnZu-Oai3Qpgeig8daovck9jE85bWy3-_aJ-bysg=s176-c-k-c0x00ffffff-no-rj,False,True,1670340444.457901
Ugwe75hgQ1JxT1j6RpN4AaABAg.9j6XwoCHnXi9jJ1XcMKv94,"0:34 - is´t Rashomon, Is Throne of Blood. 0.53 - is Battle for Algiers",6 days ago,Sir. Klünchis,UCMpRJJ05QwEjh4K20Hmo0_w,0,https://yt3.ggpht.com/ytc/AMLnZu-eLAZtIuC2GVzs28NDhwRc9jMRegtGEksAQUj_fg=s176-c-k-c0x00ffffff-no-rj,False,True,1670426844.459911
Ugy6IkUJtpI178gLjSJ4AaABAg,"my all favorite is ""apocalypse now"" -then in non order ""the godfather 2"" -""oldboy""-""mulholland drive"" -""mirror"" ""taxi driver"" !!!! my other favorites are :""the duellists""-""midnight cowboy""-""pink floyd the wall""-""splendor in the grass""-""baby doll""-""blade runner""-""excalibur""-""vertigo""-""the birds""-""carrie""-""blow up""-""little big man""-""the graduate ""-""kes""-""amadeus""-""the servanr""-""the manchurian candidate""-""great expectations""-""all that jazz""-""mahler""-""three woman""-""dr strangelove""-""network""-""cul de sac"" !!!!!!",11 days ago,patrick kever,UC_TGDfuRiVrWbjscAufJjVw,0,https://yt3.ggpht.com/ytc/AMLnZu-M8K6L6IBjVIWshZLi0jg4zDVXJw9OfxiBNc8a=s176-c-k-c0x00ffffff-no-rj,False,False,1669994844.808022
UgyKFR8LVk4BQ5ssBi14AaABAg,"Great list!  It appears that I have some cinema homework to do here. 
 I couldn't agree more with the Godfather films (1 &2 ) being at the top of this list. They are truly in a class by themselves.",11 days ago,Willie Dynamite,UCgIL0vfQoMDL9Bp7RhCFFaQ,1,https://yt3.ggpht.com/ytc/AMLnZu_3WHNLhEx_3FZMsZnSrwbtPyoBJKsKjprQ4d5J=s176-c-k-c0x00ffffff-no-rj,False,False,1669994844.810023
Ugxe-ME65iEHYlzLtCJ4AaABAg,"Good list that lacks a bit of personality, composed by well known and accepted classics. You could not really find a person behind this list.",11 days ago,nobody nowhere,UCu-lwTCbNRRDXbF3p4LuuxQ,1,https://yt3.ggpht.com/ytc/AMLnZu-H3iRuTZTXa1qLKg4u2Ojw3iwTU562GjMC9g=s176-c-k-c0x00ffffff-no-rj,False,False,1669994844.811023
Ugysfk3OqX5szIbUkvd4AaABAg,it's an extensive list but my all time favorite The Holy Mountain isn't there...,11 days ago,Alperen Börklü,UCMKW795dfJdSzBnwp7KoYMQ,1,https://yt3.ggpht.com/ytc/AMLnZu_WAYSvSf2hQqdz_WKPPPP1yDg3-g2oxQKlyL_4sA=s176-c-k-c0x00ffffff-no-rj,False,False,1669994844.812023
UgwjBEt507-rtqTR-Ix4AaABAg,I love attempting to explain Love Exposure to others.,11 days ago,Richie Digs,UCKfWaUMmXuTy7GQ699RsMig,0,https://yt3.ggpht.com/JkUG2DE8QsINEB8KmM1nIc9_RtnIz4768b7r50EgpOYHiwBuk6X0O8Zir2UXylpc10pkBu_FpA=s176-c-k-c0x00ffffff-no-rj,False,False,1669994844.813023
Ugwb5DldQhmPVn1I4it4AaABAg,"The work that went into this is impressive, thanks for making it I watched the whole thing and learned a lot about movies I've never heard of before

*your points on the LOTR trilogy are well said btw",11 days ago (edited),cloudbloom,UC60N9C-SfClL8PMn-E7OSKg,3,https://yt3.ggpht.com/ytc/AMLnZu_rbzBPM1TUi31RE34ZhMO3edKoTao1gSFf2Yxt=s176-c-k-c0x00ffffff-no-rj,False,False,1669994844.814024
UgxZ6fm7OfQWiPGbXqF4AaABAg,the woman wasnt waiting at the end of the pier and diving in the water did not yield the exclamation point for the key. V also did not put away his/her weapon when approaching the party goers. What do? Does it depend on time of day?,11 days ago,Cruising Scenes and Taking Beans,UC_eMp8ARMrnTuQLVkZHHpJQ,0,https://yt3.ggpht.com/TO72Eci_Ztz66GWU_Mwrsbz_Cm9vRX-w3H-UrQBHQTua73dQJ4qYkOncUJdNgWdtkqq0wxd8=s176-c-k-c0x00ffffff-no-rj,False,False,1669994844.815023
UgzyZvumBsZlw9dYiNN4AaABAg,"wow what an outstanding  job you did here, is not only a great list but also your description of every movie is very well done, thanks for sharing",11 days ago,jeffrey dahmere,UCQeNMF51cV1SZPo7Kjre0pg,4,https://yt3.ggpht.com/ytc/AMLnZu8I5ruoHUfL_eGX_gD26GAEfK43zYxYbFWO9z56eg=s176-c-k-c0x00ffffff-no-rj,False,False,1669994844.816021
UgyM0J--ChFQFJua3nN4AaABAg,"You, sir, have crafted the definitive “top films” list. This is a master class in how to express passion and respect for something you clearly, TRULY love. Thank you. There are a few films I still need to see on this list, but I have a hard time arguing any of them. May I ask: Why YI YI and not a Brighter Summer Day? Did you worry about including too many “epics”? Thoughts on The Matrix, Jurassic Park and children’s movies? Could a comedy ever breach the top 10?",11 days ago,Chaney Uffelman,UCUU6aZXslIrCLaIKaAm3c0g,1,https://yt3.ggpht.com/ytc/AMLnZu8E6vgMrVuVUmmedotR5OHleb8ksYo1zcnu1M3XmA=s176-c-k-c0x00ffffff-no-rj,False,False,1669994844.817021
Ugy4ECLBQiL-jMOrPDd4AaABAg,Huge W for including Yi Yi in the top 10 and Love Exposure at no. 20,11 days ago,CultureDTCTV,UCMqtl7obELhEF_gVPfSTKfg,8,https://yt3.ggpht.com/ytc/AMLnZu_zQevTkNc1OF8fy4Wp-Ji4BgWW842EnDiH12Gz7A=s176-c-k-c0x00ffffff-no-rj,False,False,1669994844.81904
UgxBXBPtsOboGVRK1Ed4AaABAg,"Before I watch this, does he spoil the movies he talks about?",11 days ago,jman84,UCwM9RRcZqQkOGjJfa6AUVRQ,0,https://yt3.ggpht.com/ytc/AMLnZu8grP8WAmaS882KfdneE89fJvfmmdhmhqWU5q5Afn5JqENoS-9pZ5WeMKFVDL-N=s176-c-k-c0x00ffffff-no-rj,False,False,1669994844.821021
Ugza49CucHnHNQ2bJRV4AaABAg,"this is a highly subjective list, laudable for its intense personal engagement, but the 'greatest' tag is highly problematic. it must be ego that allows this channel to use the word 'greatest' instead of 'favourite'. pier paolo pasolini, michelangelo antonioni, satyajit ray, glauber rocha, ritwik ghatak, tsai ming liang, lav diaz, masao adachi, miklos jancso, jean-luc godard, sergei parajanov, reiner fassbinder, werner herzog, aki kaurismaki, abbas kiarostami, nuri bilge ceylan - and above all, robert fucking bresson, robert fucking bresson motherfuckers (!!!!)  - among many, many others not featuring in the list and yet no urgency exhibited for deploying 'favourite' instead of 'greatest' is pure arrogance and narcissism. north american entitled pieces of shit!",11 days ago (edited),আগামীতে অবিভক্ত বাংলা,UCV1bPdqBCk2nB_fA5nq7_lw,0,https://yt3.ggpht.com/ytc/AMLnZu_Z5gni7kwDVXxPX98dXdYJRrkC_biuWnx6Vc8b=s176-c-k-c0x00ffffff-no-rj,False,False,1669994844.821021
UgyNvObAW6Nhp4Pc1W54AaABAg,"Mulholland Drive for me was the story of a woman and her dream (Hollywood Star), and then the reality of suicide for not getting the dream, and was the saddest story I had seen on cinema, and thought the capacity of Lynch to reach so deeply delivering the feeling of sadness and loss so directly was genius.",11 days ago,Pich mc itofun,UC_rAMWGVV4KmK9BlxN9bD6Q,14,https://yt3.ggpht.com/ytc/AMLnZu9v08N4Dt0KuEC1Cfj8WN5fGkXBYWUH2Uqhjuv2Rg=s176-c-k-c0x00ffffff-no-rj,False,False,1669994844.823024
Ugyx2l3G6bF9HzHdlQp4AaABAg,"It's too new to know how it will stand up, but I would add Everything, Everywhere, all at Once to the list of greatest movies. It's masterful in the way it uses film techniques (both technical and storytelling) to tell a story that couldn't be told any other way, and it captures feelings that are part of life now, but we barely understand how to name or acknowledge.",11 days ago,Tyghe Deerfield,UCqA8xQOVU7VuxZejte-rM0g,0,https://yt3.ggpht.com/ytc/AMLnZu-nVUyjzV39vaqVJOcNjxdSQ_N2kR54OfQXb1ESLw=s176-c-k-c0x00ffffff-no-rj,False,False,1669994844.824022
UgymDL9KhZToNjgazaN4AaABAg,"Eh, no The Shining. Great job.",11 days ago,Kenji Polk Audio,UCWHA6QHpGUdzYciTC3j7x-Q,0,https://yt3.ggpht.com/ytc/AMLnZu9hYzJ0sIy4-BYfRNVsusXPr_ex1LCwpTshjinT_g=s176-c-k-c0x00ffffff-no-rj,False,False,1669994844.825021
UgzMwr315RmGayTon6h4AaABAg,"Citizen Kane isn't higher because another movie could've been better? Really enjoying this btw, just found that a bit odd",11 days ago (edited),Joseph Chambers,UCvVVzvElyg8cYWS_xh0vG8w,0,https://yt3.ggpht.com/ytc/AMLnZu81Nrf_iTGhx3S4We-OmLzaWg74haeZ1SUzbQ=s176-c-k-c0x00ffffff-no-rj,False,False,1669994844.826023
UgykCLy_z0n8t_MCAQZ4AaABAg,No love for Chris Marker or Kobayashi TT,11 days ago,Jom63110,UClorep-gVxZw3uZqHl4I-KQ,0,https://yt3.ggpht.com/ytc/AMLnZu-VzUQouyoVfP1_RwvvQYQwav3cC06onGVQVBZv=s176-c-k-c0x00ffffff-no-rj,False,False,1669994844.827024
UgydQK_3H1ljI4auZpp4AaABAg,You can't call yourself a Ghibli fan if you've never seen Pompoko.,11 days ago,NattoSumi,UCjHMb9OTiZ15AhF4eCYkh6Q,0,https://yt3.ggpht.com/ytc/AMLnZu9kDJOt8q0mCIYR9tJIr61Pb9YtoJwgZ5DlvoE=s176-c-k-c0x00ffffff-no-rj,False,False,1669994844.829024
UgxTEVr8eJVp2s9OLrJ4AaABAg,The greatest piece of cinema in existence or at least that left the greatest impact on me is cowboy bebop,11 days ago,Luigiu S,UCR3ZU_G_6pmy-AwckxM6xzw,0,https://yt3.ggpht.com/ytc/AMLnZu_KyzV4UK9oYCYjY73V2txkvU89New3dpV3VyQ9=s176-c-k-c0x00ffffff-no-rj,False,False,1669994844.831034
UgzpOt4A4FdYOLOG71N4AaABAg,Honestly surprised Empire Strikes Back wasn't put on this list.,11 days ago,Cosmic Deer Reviews,UCdonszApCBrfAS_Qoo4pIKQ,0,https://yt3.ggpht.com/ytc/AMLnZu9t1fqrZ-Pu6NX-jSrOH8V9qaHX3R6E4pAkLhn0=s176-c-k-c0x00ffffff-no-rj,False,False,1669994844.833023
Ugwb5DldQhmPVn1I4it4AaABAg.9j6QAcXEgDo9j6W1HrhPLd,"LoTR is one of the great cinematic experiences. The sheer scale and scope alone makes it worthy of listing. My earliest memory if cinematic greatness is Jaws - seeing that in that big dark room when I was about 11, with the camera sitting at water level - it gave the impression of being in the water with the shark. So much is lost outside a cinema.",11 days ago (edited),davy K,UCW6DMZlrG3AjVhJ6mi_YHAQ,2,https://yt3.ggpht.com/ytc/AMLnZu86IokBOg2mMyu1vXts0FN6a9PDcmaYiI2oEA_q=s176-c-k-c0x00ffffff-no-rj,False,True,1669994845.075057
UgyM0J--ChFQFJua3nN4AaABAg.9j6KhyJhVqB9jBb9YG5KGa,"he just made a list of films he likes dude, it ain't that deep. It's not an act of creativity comparable to idk, making a movie. The only thing I found surprising/interesting about it was the inclusion of a Peter Greenaway movie, someone not much dicsussed even in 'film' circles. And why couldn't a comedy be number 1..? B/c that's reserved for 'serious' and comedy is not 'serious' (a more sophisticated understanding would be comedy is the MOST serious). Fellini's films are very often top 10, top 5 whatever, they're all comedies (so are peter greenaway's, really)",9 days ago (edited),Helvete_Ingres,UCmK4pCSvBtS-R9rnD9JMMsA,0,https://yt3.ggpht.com/ytc/AMLnZu_2HwKtmcaig8qiInuf2xi-IXMjJ-aioGhMNPet=s176-c-k-c0x00ffffff-no-rj,False,True,1670167645.323022
UgzpOt4A4FdYOLOG71N4AaABAg.9j69VQaLGuQ9j6JRHYZWqZ,You mean that movie in space with some space Templars and pew pew?  How does it deserve to be on this list?,11 days ago,Major Mononoke,UCgM62EHM3AGWkxbsKoCAX-g,0,https://yt3.ggpht.com/ytc/AMLnZu9Zpw3ynl_2Sa44DCvE5Ax871jLzxVpR0Tz1k6Z=s176-c-k-c0x00ffffff-no-rj,False,True,1669994845.58602
UgzpOt4A4FdYOLOG71N4AaABAg.9j69VQaLGuQ9j6LVf_N1eO," @Major Mononoke  because the original Star Wars trilogy captures the magic of the movies and without a doubt is still one of the most influential and important films ever made. Empire Strikes Back being without a doubt the film that took a goofy sci-fi film and turned it into a cinematic masterpiece. From costumes, set design, the characters, story, cinematography, the special effects. To sit there and tell me it doesn't belong on the list of the greatest films of all time you're either an edgy internet troll hating on Star Wars or you're just an artsy fartsy cinema snob. Cinema can be art and also fun for everyone, thats the point of going to the movies.",11 days ago,Cosmic Deer Reviews,UCdonszApCBrfAS_Qoo4pIKQ,0,https://yt3.ggpht.com/ytc/AMLnZu9t1fqrZ-Pu6NX-jSrOH8V9qaHX3R6E4pAkLhn0=s176-c-k-c0x00ffffff-no-rj,False,True,1669994845.58702
Ugz89K-DXxXLTiNSQsJ4AaABAg,Interesting list. I added the 13 movies I have not seen to my what to watch list. My #1 & 2 picks are LOTR and 2001.,11 days ago (edited),Lawrence Frost,UCGV9sMoccSp8lqnQLpCd4pQ,0,https://yt3.ggpht.com/HubVFgx2buJAvD4XF_Slk-G8WUcLqbS9ImuFgzGenzyGAnUjMD2Po6gCvCxDSGP2w4Wy2PAnw_0=s176-c-k-c0x00ffffff-no-rj,False,False,1669994846.140392
UgzHL2LIr0aGfX-42hB4AaABAg,"I’d have to add “A Fish Called Wanda”, “Exorcist III”, if not the original “The Exorcist”, the 1956 version of “Moby Dick” (with Gregory Peck as Ahab), “Jaws”, which is basically a modern Moby Dick interpretation, “The Matador” with Pierce Brosnan, “Alien”, “The Big Lebowski”, and I would swap “Goodfellas” in place of “The Godfather” (I know that’s probably heretical to many, but it’s just my opinion, obviously.)",11 days ago,Tunguska Lumberjack,UCh-peWFENGD_E8HNMTVJqbw,1,https://yt3.ggpht.com/ytc/AMLnZu8_WbSmj_qGZgUlXcJlgqZaE1uDpz1SOj3qavfswA=s176-c-k-c0x00ffffff-no-rj,False,False,1669994846.142392
Ugy4qbe81twoQYwf4bx4AaABAg,"0:15 -  oh no, please no. you're breaking the ONE rule by telling people about this movie. 
Gladly it wasn't actually part of the list, you cheeky bastard.",11 days ago,SupernalArts,UCFIiOqHUPAv-tHvdT8d7A6Q,0,https://yt3.ggpht.com/ytc/AMLnZu_WYDGdgez58HqOqijCZgFnDgEsNEHWKmYmnzu9=s176-c-k-c0x00ffffff-no-rj,False,False,1669994846.143395
UgwLSdd_TJQDfx_1gZZ4AaABAg,Saying Satantango is a masterpiece is the first symptom of pretentiousness,11 days ago,Matthew Charlton,UC9ZN4BfRXUp3ZuH0ZVeZoAQ,0,https://yt3.ggpht.com/ytc/AMLnZu_oebDzaWRDuevqKjrCJo8604mGtdK8TjOBhQ=s176-c-k-c0x00ffffff-no-rj,False,False,1669994846.144393
Ugy7Um4hHMBa6WUu_Od4AaABAg,"Thank goodness Sergio Leone is on here with TGTBATU, though even though that is my favourite film ever, I would have to put 'Once Upon a Time in the West' on. That film has the most glorious score ever.",11 days ago,Sean Taylor,UCwO2N5b1j25nLmCXldj_ewQ,5,https://yt3.ggpht.com/ytc/AMLnZu8l2FAskSHMPNBT3NdEvVE31OVgEQ2IHnv91RvD=s176-c-k-c0x00ffffff-no-rj,False,False,1669994846.145427
UgytE4GSugknup-k2mZ4AaABAg,Prince of Egypt is my favorite,11 days ago,JustinCowgill,UCVKofBirFz_L-5oAdnACEUQ,0,https://yt3.ggpht.com/aiSxmPlHoCkyDuZ7tKWJeC_tZ5oafFlfX8e8g7kOJZLnGJlXqCYqPeNpna1qw_ab3O5gfy9N_A=s176-c-k-c0x00ffffff-no-rj,False,False,1669994846.146426
UgyQSs_bDBwxjZQC8lJ4AaABAg,where tf is Excalibur???,11 days ago,Bob's Big Boy,UC6nMCHx2YEQqtBsjmpi745Q,0,https://yt3.ggpht.com/ytc/AMLnZu8msdRK7-r_ijNqMMICZZRBTrSePcwFyTumr7_ltg=s176-c-k-c0x00ffffff-no-rj,False,False,1669994846.147394
UgzTNXpy8QOMwXr-AqR4AaABAg,I would never watch Akira with the sound off.  That soundtrack is too amazing to miss out on.,11 days ago,Olas Rives,UC4A8TrHO2KvrH85mhJIB8_g,0,https://yt3.ggpht.com/d3nUbX6yDINxBfmLNDHi1Ta-F6XfVoI35d4l2bbuHuKlIUsekq26nOf-1F2XlIbcOcg6hRBI=s176-c-k-c0x00ffffff-no-rj,False,False,1669994846.148426
UgyMSoSJCNuZWsz1fLp4AaABAg,I like how you pronounce 'ordet' xD,11 days ago,Novice Sprinter,UCnbkLx0WJO-2z96RSY6GeSw,0,https://yt3.ggpht.com/ytc/AMLnZu9Egna46OCjRsg3PBIsRLkHDIdKquC5k0lONg=s176-c-k-c0x00ffffff-no-rj,False,False,1669994846.149429
UgzYo378vzX0Ud-bBKt4AaABAg,Very good list. Most of my favourites  were there. 💜,11 days ago,Ananya 17,UCuozyKTiHIA3bByzVKR1yWw,3,https://yt3.ggpht.com/CqZjrX1rGa0QSvt6pt73KGrmP6QALj-xHL3Od9rmhsWkjzs7RSAW-QnXAbXaGEcy_gxFeH47=s176-c-k-c0x00ffffff-no-rj,False,False,1669994846.150426
UgxVZuSD1vRgsorO07J4AaABAg,"Come and See
Before Trilogy
Should be somewhere here.",11 days ago,Stefano_pena,UCIUBzUHfBanN2hAkcm2Xikg,5,https://yt3.ggpht.com/ytc/AMLnZu8seO32VvYLD9DXTztil41BZrPIEwwYq3LECUzqJg=s176-c-k-c0x00ffffff-no-rj,False,False,1669994846.151433
UgwN7mHUayE6Em9-mBx4AaABAg,gone with the wind sucks tho jeez,11 days ago,Bob's Big Boy,UC6nMCHx2YEQqtBsjmpi745Q,0,https://yt3.ggpht.com/ytc/AMLnZu8msdRK7-r_ijNqMMICZZRBTrSePcwFyTumr7_ltg=s176-c-k-c0x00ffffff-no-rj,False,False,1669994846.152426
Ugyxkrf9-DI3Xa3Y7hR4AaABAg,🖤👏,11 days ago,J Carrera,UC7ylwdTx_N7vVUihX_2gfpQ,1,https://yt3.ggpht.com/ytc/AMLnZu8LoxHz5xBEq2glNEPITsEK3e3ss_N-e-SxL5RHqQ=s176-c-k-c0x00ffffff-no-rj,False,False,1669994846.153427
Ugz6dArRDwrAM6jCyv14AaABAg,Can someone explain why the hell does this channel just open the comment section after 7 fucking years?,11 days ago,mang_0nim,UClmi9-4Ob9gTmWIVpVgxgAA,0,https://yt3.ggpht.com/LBBn8hjag2_YB0_pinXN04TfXBmsirQeFDNuj18_5a8bP2hPKfkzkPRt2LJetehkTlZpMffvfA=s176-c-k-c0x00ffffff-no-rj,False,False,1669994846.154426
UgxYml-WD5ChyNXoXm54AaABAg,no wenders???? herzog???? cronenberg????,11 days ago,Bob's Big Boy,UC6nMCHx2YEQqtBsjmpi745Q,0,https://yt3.ggpht.com/ytc/AMLnZu8msdRK7-r_ijNqMMICZZRBTrSePcwFyTumr7_ltg=s176-c-k-c0x00ffffff-no-rj,False,False,1669994846.155393
Ugy34hGOAO_Lt5vy7-F4AaABAg,On what basis did night of the hunter get so panned?,11 days ago,Justin Haslam-Lucas,UCRcwaCMn5UtVyC1qSgE537w,1,https://yt3.ggpht.com/ytc/AMLnZu-WpzFX-wSOxTo6wU0TKoQ7BBtO40YHx6ZByg=s176-c-k-c0x00ffffff-no-rj,False,False,1669994846.156428
UgwcACu4PoCvNh4oozN4AaABAg,as a film snob... decent list :),11 days ago,Bob's Big Boy,UC6nMCHx2YEQqtBsjmpi745Q,0,https://yt3.ggpht.com/ytc/AMLnZu8msdRK7-r_ijNqMMICZZRBTrSePcwFyTumr7_ltg=s176-c-k-c0x00ffffff-no-rj,False,False,1669994846.157427
UgxBcYZavvC-CtyTnNV4AaABAg,This is definitely a list,11 days ago,Zat1,UCukw_ukUGDf1SJW8IyAP07w,0,https://yt3.ggpht.com/ytc/AMLnZu_g0PHMp2cpF5juTloZUx90P2QlErdpl6Q9Tw=s176-c-k-c0x00ffffff-no-rj,False,False,1669994846.158428
Ugwa0cPDYy_EF0SOsph4AaABAg,"Great video but you don't seem to be much of a horror fan. I feel ""The Innocents""(1961) and ""Possession""(1982) both deserve to be on this list ..ahead of a few of them.",11 days ago,Sagar Saxena,UCXXqCLEUBhHOC7p6In_Id8A,1,https://yt3.ggpht.com/ytc/AMLnZu-KTalYBCK4hTqSkOjjdmG_-Vqp1Yi-aK_mOVkevg=s176-c-k-c0x00ffffff-no-rj,False,False,1669994846.159393
UgxVG5GXsGhvuMSXC294AaABAg,So just the S&S/TSPDT list while omitting Renoir and Fellini to be an edgelord? It's amazing how everyone on youtube manages to say the exact same shit we've all heard for a million times while framing it like they came up with it,11 days ago,Lennart,UCu0EW7kL3QnHWjhRU1GONrA,0,https://yt3.ggpht.com/ytc/AMLnZu-HAYJvJAGFXqEHLU7jTBaCTH9dIEqAFIAlNA=s176-c-k-c0x00ffffff-no-rj,False,False,1669994846.160394
Ugy7Um4hHMBa6WUu_Od4AaABAg.9j66PmMIBXV9jNLQeVEW9M,I agree!!,5 days ago,Linjica Konikon,UClOVR3CcBNN0tqj1uMSB0Zg,0,https://yt3.ggpht.com/ytc/AMLnZu8czfIBWeiSI2jFmfEZQKUXqdjJQURjWAdWyg=s176-c-k-c0x00ffffff-no-rj,False,True,1670513246.424701
UgzYo378vzX0Ud-bBKt4AaABAg.9j5yhuBZdk29j6i5b4wCJd,If only we all could share a cinema theatre together and watch them all !,11 days ago,Jim Newcombe,UCtMkf1V5l5ylLp_qaMKSUUg,1,https://yt3.ggpht.com/ytc/AMLnZu8npJRHvNxJPtavFhoPiiKB7IrAQ2vGDs1dczB2=s176-c-k-c0x00ffffff-no-rj,False,True,1669994846.667692
UgwN7mHUayE6Em9-mBx4AaABAg.9j5xik25jE-9jEUM7uNoLF,not really tho,8 days ago,mr smith,UCXEz1zxrBWS6eVfTHfh3t6A,0,https://yt3.ggpht.com/ytc/AMLnZu9k7DNvJtd-vWLOWV1GW0K-ezPc1WRFJykVeZERMeKGgAOT692shR7vvzqOC6GN=s176-c-k-c0x00ffffff-no-rj,False,True,1670254046.95761
UgwCYz6j5zeNqcdixd54AaABAg,You had me mostly nodding ... until The Godfather ... I simply don't get the fascination these movies seem to get from cinephiles. They should not even be in a top 50 imo ... and then I realised that Vertigo & Caligari is not there on the list .. a travesty ! :-),11 days ago (edited),Mandibil,UC3vWKPe1PW8hxIs_k0SwbiA,0,https://yt3.ggpht.com/kSDZ_FpEUAerYZ0fpSNooqd4bidfmunf-eQiKioEYhFp6s1qY3Xc4OFBLcRfkNYs2CZ4CUHNtB0=s176-c-k-c0x00ffffff-no-rj,False,False,1669994847.344613
Ugyw0xuhR_7t5ZZdhEx4AaABAg,No Parasite?,11 days ago,Pabungus,UCSuzinNDmUFyGZ6G8gh2-fA,0,https://yt3.ggpht.com/DbnwZqYcE5JuYEfH16yxe1Nii3Uf7z2AQFUypoM-qVQ5bzM1mrbBRE0g4bVTIuWv_BSRHMfr=s176-c-k-c0x00ffffff-no-rj,False,False,1669994847.345576
Ugx6OXhCuTcxh5J4rIZ4AaABAg,"No mention of Cloud Atlas, A Ghost Story, My Hindu Friend, (n)or Blade Runner 2049.. ,?... 🤔🤨😶😑🙄🤷‍♂️🤷‍♀️🤦‍♂️🤦‍♀️😂😶
😂😂😂😂🤣😂😂😂😂😂😂🤪🥴🥴🤔😂😂😂😂🥴🥴🥴🥴🥴🤪😂
I DO Hope For Your Sakes this list is Subjective.. ...its Certainly Not Entirely Correct.. ..THAT'S for Sure.🤦‍♂️🤦‍♀️
- And I'll be Happy to (Further) Explain Any or All ah those titles... . 🙌",11 days ago (edited),drumbum3.14,UCxEFmlAqVG06gqXK3awLKHw,0,https://yt3.ggpht.com/ytc/AMLnZu8LG8qD3FhUFJayl6xP6ZUFj3RI3hVd-QqD94uYZ0nAn6kc4QyLroAPhX1JqcHE=s176-c-k-c0x00ffffff-no-rj,False,False,1669994847.347578
Ugyf6uY6ogoMMlhNTyp4AaABAg,Where's Morbius?,11 days ago,Rodrigo Ele,UClkrcO17vNSp3cSscEQFyng,0,https://yt3.ggpht.com/jcHi4ZVE48O_7KvcV5NicIpPSw5twS-jWTHUkWpjXOIEI2WKE1ArW48edNH4yrGybutalw3IeQ=s176-c-k-c0x00ffffff-no-rj,False,False,1669994847.348613
UgyXQIn0Gqj2z1ackMZ4AaABAg,Fun Fact: my favorite film of all time is Shaun Of The Dead (2004),11 days ago,Abrasious Productions,UCTOg6eG3vvfx1GjUPSBIW2A,4,https://yt3.ggpht.com/ytc/AMLnZu_ywq7alYctq5bla5aQz2LcWiUCFN6RI0b1SeIC=s176-c-k-c0x00ffffff-no-rj,False,False,1669994847.349609
UgzR3aLy2H53tNXuDWx4AaABAg,"""my favorite 30 films""*",11 days ago,Random Cinematic,UCwt5y4f81D-SrCQXwP8866w,0,https://yt3.ggpht.com/ytc/AMLnZu-H299OLy89p0hCJaPRgtyKWbQ_726fo_xOAJPs6g=s176-c-k-c0x00ffffff-no-rj,False,False,1669994847.350613
Ugxp__13d9-QMf4AoPF4AaABAg,How come Mulholland Drive over Persona? A disappointing development among younger cinephiles.,11 days ago (edited),Tony,UClYDTAdWMTUqfL5TQhgJzLQ,0,https://yt3.ggpht.com/ytc/AMLnZu-1a1JhKARKDkJ0STdDwRFBe7EUYXLjieiFCwXfTQ=s176-c-k-c0x00ffffff-no-rj,False,False,1669994847.351578
UgxwBhj3OCpslFzdzUt4AaABAg,"27:46 YES!!!!! My all time favorite I do declare. Yes yes very hard to watch at times I must concede, but also it is sooooo beautiful at others. This score is beyond gorgeous (❤‍🔥the track fish beach❤‍🔥) , these performances are the finest I've ever seen, the visuals are ofc very painting-like, and for a director who doesn't respect dialogue its pretty damn great. No matter where I am or what I'm doing there's always a chance I'll randomly think abt how brilliant a scene from this film was. You may not love it as much as I do but I IMPLORE you to give it a watch cuz holy shit it's an unforgettable experience I tell you",11 days ago,Will Foley,UCgphagtYDEd7zG5Wmm2iLdg,7,https://yt3.ggpht.com/ytc/AMLnZu8Pucz6gsoR2W3CNSY91PhK-Q6gnFwQzbHJQQ=s176-c-k-c0x00ffffff-no-rj,False,False,1669994847.35261
UgzMA__RxZtnbadmo9t4AaABAg,The greatest film is all the friend we made along the way,11 days ago,Devananta Rafiq,UCy3D0VWu1rCMMwrPpo7N6mQ,0,https://yt3.ggpht.com/ytc/AMLnZu9x7eXnuB-BEHHsyPvIi3ihXHoqcitxc0vC4thAYg=s176-c-k-c0x00ffffff-no-rj,False,False,1669994847.353613
UgwxhPc2KLXgGLxC0Up4AaABAg,I disagree.,12 days ago,TheOneTrueKit,UCdSc3ruDSGvbF4wZR7Ktcbw,2,https://yt3.ggpht.com/ytc/AMLnZu_pVao7o4d9F06mV_zZXalRuEkA4DTxi88OpXrU=s176-c-k-c0x00ffffff-no-rj,False,False,1669908447.354609
UgxeLMiyJ2M4ALUMlit4AaABAg,"I'm very surprised there was no Hitchcock in the list, I was sure Vertigo was going to be the number 1 spot",12 days ago,Sebastian Pinilla,UC-m2dCixhV5jtzZeCNahIRw,1,https://yt3.ggpht.com/g53abxKcngiFW_8FjIssmHwO44RIozsr4jGTlR6EXqAIluYdJE9c7Y4EewwMZAffM4EGQQsK=s176-c-k-c0x00ffffff-no-rj,False,False,1669908447.355578
Ugz6DAFFmPdpQzK9RYJ4AaABAg,"Thank you for this, I've forgotten already how much I love a lot of these films,. It was like seeing old friends after a long time",12 days ago,lovepiecozitsawesome,UCuNljew-LmQkYLi_UMYuw1A,6,https://yt3.ggpht.com/ytc/AMLnZu88WujCUxbmwNeewCq4OFk9doXNj2bfeTTTvoCY=s176-c-k-c0x00ffffff-no-rj,False,False,1669908447.356609
Ugxzz1XHN0tbhTn8mIF4AaABAg,45:15 Morbius Sweep!!!,12 days ago,Eric,UCPCo3xj4CiUUm1TkTr-LDAg,0,https://yt3.ggpht.com/MJxtU1s0rP7-JF8wUBCuWIgGvW4mYv1fvi0QcvG3vPphp7jNK1EQwCste3cddZhdzR9dTaTWyw=s176-c-k-c0x00ffffff-no-rj,False,False,1669908447.357609
UgyVMSN0o8dsgrqRLm14AaABAg,"Beautiful list.  I was pleased to see my own favorite film, Mulholland Drive, make your list.  I appreciate your work.",12 days ago,Evil Roy,UC-kGXs5jsbU_4X_fO0JHdDA,3,https://yt3.ggpht.com/ytc/AMLnZu_vAhZgK9xs1YmCRyG20p5HmkRDRyZYKJKosg=s176-c-k-c0x00ffffff-no-rj,False,False,1669908447.358609
UgwQr5blfIzYT3LjMCd4AaABAg,Thank you for the video.  You''ve given me a list of movies to seek out and watch.,12 days ago,Chris Benavides,UC1LoitK1YysbmV6yMCens3g,0,https://yt3.ggpht.com/ytc/AMLnZu8MRmJw2Mx6RSboMKwCZ9KHDpNiBkGh0qNRjkvtjg=s176-c-k-c0x00ffffff-no-rj,False,False,1669908447.359577
Ugw39H5n5M9rfk0hrH54AaABAg,I knew it was coming but that godfather 1 & 2 top place ranking was a gut punch. I really want to love these films I feel in the minority of people who just don’t adore the film I think it’s a five star but nowhere near the greatest! But your analysis did put another perspective and has made me want to rewatch! Them 4ks will be here tomorrow:),12 days ago (edited),Gorehound,UC6muMY-xZVi4eFsCTYwYdkA,6,https://yt3.ggpht.com/F1uYCWuL4puiP_6vngD-8yKyBFK0dO9SfFLgrzSFmiBqL5vmc7_naBCGHU3QU4xvtAhZZDfmhDI=s176-c-k-c0x00ffffff-no-rj,False,False,1669908447.36061
UgzLcPGjvdp1daI2Sxd4AaABAg,Guys calm down its his personal taste don't need to be over smart and say where's hitchcock or Charlie Chaplin etc everyone have their own taste in films you're not superior 😁,12 days ago,Co thinker,UC-tB8NiNqCBUTIuxNldQz_A,2,https://yt3.ggpht.com/_Lx8Dfx9QCIJHKIJwaQ8wxyFFMo0nDPfb-NNe44Kk2b2WpL815v2rp1P86S_Q6i-dtxE6G8u=s176-c-k-c0x00ffffff-no-rj,False,False,1669908447.361609
