cid,text,time,author,channel,votes,photo,heart,reply,time_parsed
Ugw8_i1ZIM5_dwDsMJt4AaABAg.9j5XTBtPbDl9j67B2uaXMU,"​ @Fredo Corleone  To be fair to immortal nightbody, the time stamp tells you the number, not what they are. They did conspire to make you sit through 2 hours of video. It IS a video essay channel, but what if I was interested in their thoughts on specific best of films and not all of them? We live in a boutique era where people want [and have] the option to pick selectively. I don't see the purpose in shouting down someone who is representative of that perspective.",11 days ago,Focused Obsessions,UCswCrOVYl_zDeuvifUZ3_eg,13,https://yt3.ggpht.com/ytc/AMLnZu_szHcXCgZXCGQtAwpy-q-W-1uHZ1iZwCXbLj9wFQ=s176-c-k-c0x00ffffff-no-rj,False,True,1669994854.820176
Ugw8_i1ZIM5_dwDsMJt4AaABAg.9j5XTBtPbDl9j6BaxSAUSL,Tokyo Godfathers. Grave of the Fireflies.,11 days ago,Is [N0T] 42,UCYt6wIv3Wp64f3bSUJ8Cn1A,2,https://yt3.ggpht.com/ytc/AMLnZu-WIZObTyd3cvq8hMAS4kKUFV8ReCLcV-MU1Fzp=s176-c-k-c0x00ffffff-no-rj,False,True,1669994854.822144
Ugw8_i1ZIM5_dwDsMJt4AaABAg.9j5XTBtPbDl9j6MeORKsz0,Thanks yo!,11 days ago,470K,UC8UXdKKgvZlEI2RtGCVMWZA,0,https://yt3.ggpht.com/ytc/AMLnZu-ybIlVJDlYEaX0tSR_zwh95XFjTimwGyDueGknmQ=s176-c-k-c0x00ffffff-no-rj,False,True,1669994854.82418
Ugw8_i1ZIM5_dwDsMJt4AaABAg.9j5XTBtPbDl9j6of5zOwKy,it insists upon itself,11 days ago,James Henley,UCCUYZfMLkpwRyI9CcA6m_Gw,2,https://yt3.ggpht.com/ytc/AMLnZu-NbBEp-CElrMxfOpQCHGFGYkB7x5qd-OXQ2zFX6A=s176-c-k-c0x00ffffff-no-rj,False,True,1669994854.826142
Ugw8_i1ZIM5_dwDsMJt4AaABAg.9j5XTBtPbDl9j7-aufzM66,"How is it that Inarritu, Cuaron, and Del Toro films are ALL missing from this list? RIDICULOUS!",11 days ago (edited),G,UC-MHUTUhC4exHpM1hzEuDhA,1,https://yt3.ggpht.com/ytc/AMLnZu8Y1eKg58VfZaT4WZoV5Yp15MIojG5Y9XrtYqfnxw=s176-c-k-c0x00ffffff-no-rj,False,True,1669994854.828176
Ugw8_i1ZIM5_dwDsMJt4AaABAg.9j5XTBtPbDl9j76pW1bwQ0," @Focused Obsessions  I also hate when people don't include timestamps in order to trick people to watch the whole video. I get that youtube doesn't like when people just click through the video and as a result promote it less, but also don't make stupid TOP # videos if you want people to be engaged and not just click through it to check what's in the list.",11 days ago,James Evans,UCL1EpoRq1iIAouxnLn1pCyw,0,https://yt3.ggpht.com/MMHXcJ8DILGlTtb-TRf_08y9fjRE-7-ceoASEEnKJACf0Sh4WHbqbXhLD05zrDKrTWCzSEctGg=s176-c-k-c0x00ffffff-no-rj,False,True,1669994854.829177
Ugw8_i1ZIM5_dwDsMJt4AaABAg.9j5XTBtPbDl9j7DQUwbTkL,Le Samourai? 400 Blows? Seems lacking in French New Wave. No Mellville in the top 30? I am suspicious :),11 days ago,Northwest Psychfest,UC96CoBq860fa7NM-SUa5fZw,1,https://yt3.ggpht.com/ytc/AMLnZu91cQlwcJvLV639kHo9jMWRHP0TVHo4ULBGiNsJ=s176-c-k-c0x00ffffff-no-rj,False,True,1669994855.237176
Ugw8_i1ZIM5_dwDsMJt4AaABAg.9j5XTBtPbDl9j83KPRkeW9," @G  well, Why tf Del Toro would be in a list with the 30 greatest films of all times?",11 days ago,NUCLEAR DASH,UC2bcwXGUtHju5HvuyFT-cyA,3,https://yt3.ggpht.com/ytc/AMLnZu-_d_kzOcXobwypSZcPDlLGDnhAXU_XqK8cmCaAC5Y=s176-c-k-c0x00ffffff-no-rj,False,True,1669994855.239171
Ugw8_i1ZIM5_dwDsMJt4AaABAg.9j5XTBtPbDl9j8nQWVVZmx,"Nice list. Personal favorites there Ordet, Akira (very nice tho see it here), Tokyo Story (but I am an absolute  Ozu fan and I like some other movies from him even more ), Persona, Spirited Away, 2001 and a handful more. I miss some Wenders, Buñuel, Juan Antonio Bardem, Fellini, Antonioni (I know, many hate him but I absolutely love him), Pasolini, Tati (Playtime is a must for me), Robert Bresson, Kieślowski, Jerzy Kawalerowicz.... I think the list would end too long 😅. But yeah, I miss specially some more italian, french and spanish representation, I know well their cinema, many jewels there.

Jeanne Dielman...! Very nice pick that one.",10 days ago (edited),TENTSIO,UCs-mIMnZivzXXw5oTbSXOLQ,1,https://yt3.ggpht.com/ytc/AMLnZu8v3W5iKw32Nat__DR2ipy6-FEty9bX9OlrdA=s176-c-k-c0x00ffffff-no-rj,False,True,1670081255.240144
Ugw8_i1ZIM5_dwDsMJt4AaABAg.9j5XTBtPbDl9j9VD0TEJNN,Fellini not in the top 30? No Fritz Lang? :),10 days ago,Northwest Psychfest,UC96CoBq860fa7NM-SUa5fZw,0,https://yt3.ggpht.com/ytc/AMLnZu91cQlwcJvLV639kHo9jMWRHP0TVHo4ULBGiNsJ=s176-c-k-c0x00ffffff-no-rj,False,True,1670081255.241143
Ugw8_i1ZIM5_dwDsMJt4AaABAg.9j5XTBtPbDl9jBakDMzk4a, @G  maybe because those aren't very important film-makers in the grand scheme of things and haven't made films that would actually belong on a 'greatest' list? I guess that would be the reason. What's truly 'ridiculous' is expecting everyone to cater to your own personal favourite things,9 days ago,Helvete_Ingres,UCmK4pCSvBtS-R9rnD9JMMsA,0,https://yt3.ggpht.com/ytc/AMLnZu_2HwKtmcaig8qiInuf2xi-IXMjJ-aioGhMNPet=s176-c-k-c0x00ffffff-no-rj,False,True,1670167655.242142
Ugw8_i1ZIM5_dwDsMJt4AaABAg.9j5XTBtPbDl9jCjnpLBiCT,No come and see? Sad,9 days ago,peachtime,UCiSXf4UWXvpJFzPZeaMD6EQ,0,https://yt3.ggpht.com/M_f_YSlMpoCib4fw_MSOavACdQPc8YUN35XRUDV5W2YOUEtDTP0AGQ5ISi132jpZSLVlz3CI=s176-c-k-c0x00ffffff-no-rj,False,True,1670167655.243143
Ugw8_i1ZIM5_dwDsMJt4AaABAg.9j5XTBtPbDl9jDRmxOD1ao," @Northwest Psychfest  'French New Wave' was just a movement where french film critics started making their own films - and of course those same critics made their own films a part of canon, when they're really totally insignificant compared to Renoir, Bresson, etc. 400 Blows is a great film but Truffaut is FAR from a great film-maker, he should have stopped there tbh. You're only looking for 'french new wave' b/c you've seen enough lists like this to have some idea of a canonical one that all should conform to, even when the point is to choose your personal ranking. You film-nerds are completely unoriginal, no mwonder you spend all your time passively absorbing images on a sceen",9 days ago,Helvete_Ingres,UCmK4pCSvBtS-R9rnD9JMMsA,1,https://yt3.ggpht.com/ytc/AMLnZu_2HwKtmcaig8qiInuf2xi-IXMjJ-aioGhMNPet=s176-c-k-c0x00ffffff-no-rj,False,True,1670167655.244147
Ugw8_i1ZIM5_dwDsMJt4AaABAg.9j5XTBtPbDl9jDe36VErDa," @Helvete_Ingres  I know far more about the movement than you suggest. 400 Blows had a huge impact on contemporary cinema. Similarly, I think omitting Melville from the top 30 to include something like Lord of the Rings is a misstep. Certain other omissions feel just as egregious. No Fritz Lang? No Fellini? No Bresson? No Cocteau?  No Italian neorealism?",8 days ago,Northwest Psychfest,UC96CoBq860fa7NM-SUa5fZw,0,https://yt3.ggpht.com/ytc/AMLnZu91cQlwcJvLV639kHo9jMWRHP0TVHo4ULBGiNsJ=s176-c-k-c0x00ffffff-no-rj,False,True,1670254055.245143
Ugw8_i1ZIM5_dwDsMJt4AaABAg.9j5XTBtPbDl9jDzSTv4f8W," @Northwest Psychfest  and by 'misstep' you mean, deviating from some canonical and singular 'list' you've pieced together from reading sight & sound's or something. What's the point of anyone compiling a PERSONAL list if they're ideally all to converge on the same bunch of films/film-makers? You know historical importance is irrelevant there, right? Why click on this video and complain about not seeing the same list you've seen regurgitated with few minor variations elsewhere? Just to judge how conventionally 'correct' it is according to what the couple of film publications you consume tell you? Do you even get any personal enjoyment out of this litany of films and movements you appeal to, or have you just learned which ones 'had a huge impact on contemporary cinema'? 'something like lord of the rings' - predictable commercial = bad verging on self-parody of a letterboxd pseud there. Idk this is just the essence of philistinism to me. And this list IS largely 'canonical' (ie. conformist) to begin with, the only interesting thing I saw was the inclusion of a Peter Greenaway film, someone who is genuinely under-discussed even within 'film' circles. Imo, Melville is of no real worth whatsoever and I really think you mention him just b/c if you do a bit of reading on your 'french new wave' you'll often see him listed as an influence. However unverifiably true that may be, his films just don't do anything for me, actually les enfants terribles was legit b-a-d to me. The average 'french new wave' film is some kind of film-noir pastiche like Breathless I like the 400 Blows too I thought it was the best film on childhood until I saw Pather Panchali) but the sequels really are  bad enough to ruin Antoine Doinel forever for me. That's my opinion. Even glancing at this person's list, I can right away see they don't have much regard for silent film as they only include one and it's a very 'canonical' one (Sunrise), feels tokenistic. My own list would have more, so what? Not everyone has to like silent film. I also see no animation - some people don't even think of animation as part of 'cinema'. That's fine too. Bresson is one of my most admired film-makers but he epitomises 'not for everyone'",8 days ago,Helvete_Ingres,UCmK4pCSvBtS-R9rnD9JMMsA,0,https://yt3.ggpht.com/ytc/AMLnZu_2HwKtmcaig8qiInuf2xi-IXMjJ-aioGhMNPet=s176-c-k-c0x00ffffff-no-rj,False,True,1670254055.246143
Ugw8_i1ZIM5_dwDsMJt4AaABAg.9j5XTBtPbDl9jH8FeP2FdH, @G  ...it's a top 30 movies of all time list. I wouldn't put movies from any of these directors on my top 30,7 days ago,Tarang Nair,UCuGWXU8L7QxcjC1QeQCfnVw,0,https://yt3.ggpht.com/ytc/AMLnZu8FNqyZLcJ5rNvRwdoK6JDVIRfS2d_h6_uhXCrwOg=s176-c-k-c0x00ffffff-no-rj,False,True,1670340455.247144
Ugw8_i1ZIM5_dwDsMJt4AaABAg.9j5XTBtPbDl9jQl9uXwKnN,Thank you for naming the films,3 days ago,Apathesis0,UCBAvVhkzOS1pC-s-rchUFQQ,0,https://yt3.ggpht.com/ytc/AMLnZu8hc-js-Klq6XBokp7pisGBf-x2jbN4E5l9LQ=s176-c-k-c0x00ffffff-no-rj,False,True,1670686055.248143
Ugw8_i1ZIM5_dwDsMJt4AaABAg.9j5XTBtPbDl9jRfrAL3Cnt,"Thank you. A lot of movies I haven't seen that I will now look forward to seeing. I agree with a number of them including Citizen Kane, Old Boy and Spirited Away. Solaris by Tarkovsky would have made the list over 2001 but I would have added Dr. Strangelove. Sunshine of the Spotless Mind would have made my list as well as Waltz with Bashir which is one of the best war films I've ever seen. As you said there's so many films that could make a top 30 depending on the year or mood you're in. A great list nonetheless.",3 days ago,honuman39,UCPuwXlrZYq_51GesmSBBKcA,1,https://yt3.ggpht.com/ytc/AMLnZu_Y9j5VuGoB3ORrJJHaNtuiT-gXzCAwzMFjCg=s176-c-k-c0x00ffffff-no-rj,False,True,1670686055.249142
Ugw8_i1ZIM5_dwDsMJt4AaABAg.9j5XTBtPbDl9jRh49CJrJ2," @honuman39  Solaris over 2001? Interesting...can't say I agree, but they're both wonderful films. Dr. Strangelove is strangely underrated. You'd think a movie that good would get more attention.",3 days ago,Tarang Nair,UCuGWXU8L7QxcjC1QeQCfnVw,0,https://yt3.ggpht.com/ytc/AMLnZu8FNqyZLcJ5rNvRwdoK6JDVIRfS2d_h6_uhXCrwOg=s176-c-k-c0x00ffffff-no-rj,False,True,1670686055.250142
Ugw8_i1ZIM5_dwDsMJt4AaABAg.9j5XTBtPbDl9jRij7_mBi1," @Tarang Nair  for what it's worth I think 2001 is unfortunately a product of it's time. The pacing can be grueling especially the space scenes. In 1969 seeing realistic looking space craft in realistic looking space would impress enough to hold the audience but feels a little pompous and dated to me now. The themes are important but the ending is opaque.  Solaris' themes are also important and they impress me more because they are more realized. Even though it's also slow, the pacing has more of a purpose that pays off at the end. It's one of the few movies I've seen that aims for the metaphysical and succeeds imo. Thanks for responding",3 days ago,honuman39,UCPuwXlrZYq_51GesmSBBKcA,0,https://yt3.ggpht.com/ytc/AMLnZu_Y9j5VuGoB3ORrJJHaNtuiT-gXzCAwzMFjCg=s176-c-k-c0x00ffffff-no-rj,False,True,1670686055.251144
Ugw8_i1ZIM5_dwDsMJt4AaABAg.9j5XTBtPbDl9jRmBuBX3AS," @honuman39  I think that was kind of the point of 2001. It's either unbearably boring or hypnotic. It comes down to the individual viewing experience. I think the ending is supposed to be intentionally ambiguous and mysterious as it lets us fill in things and make our own theories based on everything else we see. Solaris doesn't go on the same route choosing a slightly more traditional way to explore its themes. 

But like I said earlier, both are excellent movies",3 days ago,Tarang Nair,UCuGWXU8L7QxcjC1QeQCfnVw,0,https://yt3.ggpht.com/ytc/AMLnZu8FNqyZLcJ5rNvRwdoK6JDVIRfS2d_h6_uhXCrwOg=s176-c-k-c0x00ffffff-no-rj,False,True,1670686055.252144
Ugw8_i1ZIM5_dwDsMJt4AaABAg.9j5XTBtPbDl9jZxve11b0n,"Kinda looks like the best rated movies of all time on letterboxd tab, just missing come and see",7 hours ago,Encontro-me desvigoroso,UCAI0069PCLSUaqGztMgFKNA,0,https://yt3.ggpht.com/ytc/AMLnZu-VTkRDMdmHoxypqXbwP71ngAigzqZK84oackMAKQ=s176-c-k-c0x00ffffff-no-rj,False,True,1670920055.253143
Ugw8_i1ZIM5_dwDsMJt4AaABAg.9j5XTBtPbDl9jZz_VQy84i,"Laughable to have Kane behind a Leone or 'Gone with the Wind', ect",7 hours ago,Bobby Josson,UCzFTYyVYWylUoB-hCkydIzA,0,https://yt3.ggpht.com/ytc/AMLnZu_GQYKhRRQ-PrnywuXrNUYcMnFOrJ-90M5TkHHfJ4qJDmo_9-5RdYVDbQtX35K-=s176-c-k-c0x00ffffff-no-rj,False,True,1670920055.254143
UgwSlWPS3ojlTklkt-x4AaABAg.9j5XHRxxEVH9j68H20vDuV,"One of the best channels on YT, no doubt!",11 days ago,Jimmy1982*Playlists,UC-pyyUKlXt9RpfkZ6F8f2FQ,2,https://yt3.ggpht.com/RUr4H60lIW-EvrHqxVPXG6S0R4tu_6kvuuBB46IHnnh2uUmwdarFnm_TiH8nPGRKXEa9kWkrU-w=s176-c-k-c0x00ffffff-no-rj,False,True,1669994855.570175
UgxI6G9UiqoJZ1PwJyh4AaABAg.9j5XCfssQlG9j6K0Q7gYFA,Who is Taika Waititi?,11 days ago,Major Mononoke,UCgM62EHM3AGWkxbsKoCAX-g,0,https://yt3.ggpht.com/ytc/AMLnZu9Zpw3ynl_2Sa44DCvE5Ax871jLzxVpR0Tz1k6Z=s176-c-k-c0x00ffffff-no-rj,False,True,1669994855.841947
UgyL5fhFEfH0p3t5CP14AaABAg.9j5W8ATPTHq9j5Wd4eoKkq,"I mean Oldboy is essential viewing at least once, but I more enjoyed Burning for its finesse and mystique. Lee Chang-dong is indeed a modern master, as one of the criterion closet pickers said",12 days ago,Anon Anon (Film Archive),UChJ9fRcA1lQLyxzn93gJcTA,2,https://yt3.ggpht.com/oWFszHZU4AQTsSs7_V74Cwv97y2UUW-IdoZv4o0Gvi2VeX0fUBEiRPJTqcsO9GzUcg2SWIPUUQ=s176-c-k-c0x00ffffff-no-rj,False,True,1669908456.12291
UgyL5fhFEfH0p3t5CP14AaABAg.9j5W8ATPTHq9j5Xf70t6Ve,I don't think I could produce such a nothing statement if I was woken up from a drunken stupor and asked to explain the meaning of life. What the hell was this even supposed to mean when you conceived it in your head? Where I can only hope it sounded like a coherent thought?,12 days ago,Marco Gianesello,UCc5B0ZdShUNbwa5ccKCAFhQ,6,https://yt3.ggpht.com/ytc/AMLnZu_M1nRhM20b7KjJxqyaocHGk7D9NGkjb0-vLw=s176-c-k-c0x00ffffff-no-rj,False,True,1669908456.124909
UgyL5fhFEfH0p3t5CP14AaABAg.9j5W8ATPTHq9j5lMvK9yn5,Worst take ever on film seriously Bro if u can't watch violance film then just stick with Disney crap oldboy have depth I don't think so anyone care about freaking businessman or artist by the end,12 days ago (edited),Co thinker,UC-tB8NiNqCBUTIuxNldQz_A,1,https://yt3.ggpht.com/_Lx8Dfx9QCIJHKIJwaQ8wxyFFMo0nDPfb-NNe44Kk2b2WpL815v2rp1P86S_Q6i-dtxE6G8u=s176-c-k-c0x00ffffff-no-rj,False,True,1669908456.125909
UgyL5fhFEfH0p3t5CP14AaABAg.9j5W8ATPTHq9j5n4vYLZbX,"I have zero problem on violance. The major problem of the human existence that emotions are changing and teporary and they are shitt guiding you through life. Now this movie want me to belive that a dude have the will to punnish someone without he knows what he is punnished for. For a consecutive thirty some years putting money, infrastructure, maintannance healthcare, feeding fukin farming a homeless. For letting him know that he misses his dumass idiot suicidal sister, that as of now, the movie has finnisehed, he could start to processing her loss.

If you have a stupid ugly unhealtyh dog that was so unviable it should have been euthanized for the first glance. Now I tell you you will maintain the life of this animal for 10 years and you think you not gonna relate to it or straight love it. You do, and if yo go and see your human friends they all do the same.",12 days ago (edited),Christopher Potter,UC-9e87iXGf8VVJK_tc9RmyQ,0,https://yt3.ggpht.com/ytc/AMLnZu8-bgUyLc56xI3ueDo5LXvEg-QnBah99LEXxi6d1Q=s176-c-k-c0x00ffffff-no-rj,False,True,1669908456.12691
UgzScC2tgD0H5l0rt9N4AaABAg.9j5VqnsX8xe9j8t6na1kwx,"Same, even though I liked the list. Could use some Hawks, Bresson, or Bunuel too!",10 days ago,Patrick W. Dunne,UCJxAy4LrX43I_WCpVk_S6Iw,0,https://yt3.ggpht.com/VoNIsZsjVwgdtbn3sFdCPyTCwtBj9m7rvMzVR3H2PhX9zajh4yHcGayUfIv1WXbkc-3tUXuu=s176-c-k-c0x00ffffff-no-rj,False,True,1670081256.394943
UgyH_R9nLUj_Iaq5wVt4AaABAg.9j5VgkIpVUx9j8s2aNESNw,Great picks!!!!,10 days ago,Patrick W. Dunne,UCJxAy4LrX43I_WCpVk_S6Iw,0,https://yt3.ggpht.com/VoNIsZsjVwgdtbn3sFdCPyTCwtBj9m7rvMzVR3H2PhX9zajh4yHcGayUfIv1WXbkc-3tUXuu=s176-c-k-c0x00ffffff-no-rj,False,True,1670081256.648463
UgyclwMjdTT5G74lNyB4AaABAg.9j5UxoOOzNI9j5VPrf-fTV,"present your top 30 right here, kind sir 🧐",12 days ago,Anon Anon (Film Archive),UChJ9fRcA1lQLyxzn93gJcTA,0,https://yt3.ggpht.com/oWFszHZU4AQTsSs7_V74Cwv97y2UUW-IdoZv4o0Gvi2VeX0fUBEiRPJTqcsO9GzUcg2SWIPUUQ=s176-c-k-c0x00ffffff-no-rj,False,True,1669908456.915428
UgyclwMjdTT5G74lNyB4AaABAg.9j5UxoOOzNI9j5af9qGYhT,Such a shock that other people have a different opinion than you 🙄,12 days ago,Maciej Łątkowski,UC0ch2OqrMwhlYr6l0_HsvGA,0,https://yt3.ggpht.com/ytc/AMLnZu-gBHlDf71MFo0Ko1-JYBKISR_UaVaPA_mPiQ=s176-c-k-c0x00ffffff-no-rj,False,True,1669908456.917429
UgyclwMjdTT5G74lNyB4AaABAg.9j5UxoOOzNI9j67bkHwVaS,lighthouse lol,11 days ago,Matthew Charlton,UC9ZN4BfRXUp3ZuH0ZVeZoAQ,1,https://yt3.ggpht.com/ytc/AMLnZu_oebDzaWRDuevqKjrCJo8604mGtdK8TjOBhQ=s176-c-k-c0x00ffffff-no-rj,False,True,1669994856.919461
UgwK-3VDB9HRjcW-aoV4AaABAg.9j5Utc6T7CG9j62gBA1S0q,How about actually watching the video to find out what the films are??,11 days ago,Matt James,UC1TsjS9G6v83twycVdWJ5fQ,0,https://yt3.ggpht.com/ytc/AMLnZu-XPdFXeStZN2DFfn0iSCUp1d3ucH8IC2VJ915rNWk=s176-c-k-c0x00ffffff-no-rj,False,True,1669994857.225427
UgwK-3VDB9HRjcW-aoV4AaABAg.9j5Utc6T7CG9j63TBaE6py, @Matt James  what's the problem with having both?,11 days ago,frdbr,UC5bAztRdHVlmCGMhukxfJGg,0,https://yt3.ggpht.com/aRiogjZe0OM8mPCMMRP1V6kW_k_FYV_f-rtK8_0Hv-xIg7FAQpu3iAju_vYpTNGEsdT737d99A=s176-c-k-c0x00ffffff-no-rj,False,True,1669994857.227429
UgwbpXhmZc7f7YSEqLV4AaABAg.9j5Up1kTn5p9j5UtJ69Vfx,ehem... Your Name (2016) ?,12 days ago,Anon Anon (Film Archive),UChJ9fRcA1lQLyxzn93gJcTA,0,https://yt3.ggpht.com/oWFszHZU4AQTsSs7_V74Cwv97y2UUW-IdoZv4o0Gvi2VeX0fUBEiRPJTqcsO9GzUcg2SWIPUUQ=s176-c-k-c0x00ffffff-no-rj,False,True,1669908457.503462
UgwbpXhmZc7f7YSEqLV4AaABAg.9j5Up1kTn5p9j68T4VC8XV,He literally has persona in there moron,11 days ago,Tian Liu,UC_a-O45ssLbvNWQDvUaeBtQ,0,https://yt3.ggpht.com/ytc/AMLnZu_lfE23T_6xNeXfFEx7UWEyiYXDP_Qc9SUihw=s176-c-k-c0x00ffffff-no-rj,False,True,1669994857.504461
UgwbpXhmZc7f7YSEqLV4AaABAg.9j5Up1kTn5p9j6jNELwbWA,"I love Bergman, but in a list of 30 you'd include ten of his?  🤣 I'm not necessarily disagreeing, but many might complain that it's not the most catholic list, and I don't say that because I believe in democratic representation: what's best is best, but that's a difficult thing to proffer as some kind of desideratum (this gin is warping my vocabulary). I'll at least acknowledge that it's a better list than most - especially on YouTube. It certainly is excessive to call it a ""very weak list,"" without even using your capitals.",11 days ago,Jim Newcombe,UCtMkf1V5l5ylLp_qaMKSUUg,0,https://yt3.ggpht.com/ytc/AMLnZu8npJRHvNxJPtavFhoPiiKB7IrAQ2vGDs1dczB2=s176-c-k-c0x00ffffff-no-rj,False,True,1669994857.505428
UgyEXRiktmRep-j7pTd4AaABAg,Great list. I would lose Gone With the Wind and put in a Malick film maybe Tree of Life?,12 days ago,Michael Z,UC4czQmpX_q9mpLG2D_GmyfA,9,https://yt3.ggpht.com/ytc/AMLnZu_jKJAx-KGntgmvIiLJL_LwcSJCyd8nb_oWSg=s176-c-k-c0x00ffffff-no-rj,False,False,1669908457.928429
UgzMBJU5LbVuicjG_Rd4AaABAg,"Great list, but I'm not gonna lie: how in the hell you think you could talk about the ""30 greatest films"" without mentioning Robert Bresson? I find it intellectually dishonest.",12 days ago,Nicolas Monese,UCx3njso2dfP6AyWTEVSSAmA,1,https://yt3.ggpht.com/ytc/AMLnZu_h4JFCzLkW8fIulBRyabR8u9GEES-BDFhW7I8aOw=s176-c-k-c0x00ffffff-no-rj,False,False,1669908457.929407
UgyrRpdvxXVyRyC5Yr94AaABAg,somewhat imdb top 250 heavy… still happy to see Tarr so high up :),12 days ago,Das-Apfel,UC7ZRIFfLcVpc8odwWEP5QSA,5,https://yt3.ggpht.com/ytc/AMLnZu8oRiRk67UD7W1eIpe8f0IwPikEWiCoVvziiXuNDg=s176-c-k-c0x00ffffff-no-rj,False,False,1669908457.930427
UgwfHM5Ae5HAyfomwdN4AaABAg,Cannot wait to watch through this,12 days ago,S x,UCcbc_7yh-Dvfe9dyHHEN-jA,1,https://yt3.ggpht.com/ytc/AMLnZu-syxc5DDtm5RDebLT8jdei9_z6XGwm70jVVA=s176-c-k-c0x00ffffff-no-rj,False,False,1669908457.931427
UgyZf-oMRvbdM4ua2Yd4AaABAg,"This is an astounding list. There are a handful  in the bottom half I haven't seen so I will make it my business to see them.  The only entry I have seen that I wouldn't rate is Oldboy. It was good but I wouldn't put in this this mighty list.  It's a personal list of course - some entries I would have are missing and maybe I'd not agree with the order it is in....... but that's the point!  😀  I'd have Annie Hall and City Lights listed for example, and I'd replace Taxi Driver with Casino..Still - a superb selection.",12 days ago (edited),davy K,UCW6DMZlrG3AjVhJ6mi_YHAQ,3,https://yt3.ggpht.com/ytc/AMLnZu86IokBOg2mMyu1vXts0FN6a9PDcmaYiI2oEA_q=s176-c-k-c0x00ffffff-no-rj,False,False,1669908457.932427
UgxKE4p7gbLXzZjIvRx4AaABAg,"So.. not the greatest films of all time but your favorite films of all time. The 30 greatest films title is a bit misleading. Especially since being first through the door doesn't mean you were the best to walk through that door. So, there are a few films here that were novel in their execution but perhaps were not the best to do it. Normally, I love your videos..  I just really loathe the title to this particular work.",12 days ago (edited),Traveller 237,UC1dMwIO1NVM52tKPIv6byYA,6,https://yt3.ggpht.com/ytc/AMLnZu8juoN9f7mmlOdxYYE7cQJ-dxqH942AE1SucQ=s176-c-k-c0x00ffffff-no-rj,False,False,1669908457.934397
UgyndYTVtcErxsrxoGt4AaABAg,"here's 30 of my current ""favs"", in no particular order:
30. Dead Man (1995)
29. Your Name (2016)
28. Santa Sangre (1989)
27. Aguirre; The Wrath of God
26. The Twilight Samurai
25. Kill Bill TWBA
26. The Life Aquatic
25. Lonesome Dove (1989)
24. The Hunt (2012)
25. Another Round
22. Marriage Story
21. Prisoner of the Mountains (1996)
20. Galaxy Quest
19. Monty Python Holy Grail
18. A Knight's Tale
17. Memories of Murder
16. Sexy Beast
15. In Bruges
14. Crouching Tiger Hidden Dragon
13. Hero (2002)
12. The Human Condition trilogy
11. The Before trilogy
10. Dragonheart
9. Goldfinger
8. Casino Royale (2006)
7. Goldeneye
6. Gadjo Dilo / The Crazy Stranger
5. Black Cat, White Cat
4. Burning (2018)
3. Kingdom of Heaven Director's Cut
2. Ferris Bueller's Day Off / The Breakfast Club
1. LOTR Ext. Trilogy

Subject to change and woteva, but those are the ones that popped into my head just now",12 days ago,Anon Anon (Film Archive),UChJ9fRcA1lQLyxzn93gJcTA,9,https://yt3.ggpht.com/oWFszHZU4AQTsSs7_V74Cwv97y2UUW-IdoZv4o0Gvi2VeX0fUBEiRPJTqcsO9GzUcg2SWIPUUQ=s176-c-k-c0x00ffffff-no-rj,False,False,1669908457.935397
UgwohA6TEXT96XfIhgx4AaABAg,Good list!,12 days ago,100 Films and Other Stuff,UCrwb8afCrjaNhQFJQzulRbQ,0,https://yt3.ggpht.com/ytc/AMLnZu-PIOteQtGdYw22UMSxDk8lPhArnVjBGHzX1DKI=s176-c-k-c0x00ffffff-no-rj,False,False,1669908457.936427
UgzVJZgSnWY6L0cnryx4AaABAg,The Charles Laughton directed The Night of the Hunter?!??! As if being one of the best actors of his generation wasn't enough :D,12 days ago,kucirulz,UCYO2HUAcxbUXjOdwNkFNP8g,4,https://yt3.ggpht.com/ytc/AMLnZu_gWe6jbjlW-oFPuOg77qE3i_N0GiW1Z7Yt_w=s176-c-k-c0x00ffffff-no-rj,False,False,1669908457.937428
Ugy8SQq6-5nAV3aWi3N4AaABAg,I expected Battlefield Earth in the first place and I'm not disappointed.,12 days ago,Grev McGrevington,UC8Iq0BBiqBKfuPXeNbhnxUQ,2,https://yt3.ggpht.com/ytc/AMLnZu-9TFVI5WT2kKeSehDkAb2tO_OFd-kTMzdgEFZWbg=s176-c-k-c0x00ffffff-no-rj,False,False,1669908457.939398
Ugzcn_NCXD_6QpNkycl4AaABAg,The film I never get tired of watching is Spider-Man 2,12 days ago,Tyler Durden,UCCrSnjtX6f-PXQuT4uJvsOQ,4,https://yt3.ggpht.com/ytc/AMLnZu8i9DA3hPV538mhTVDvutMO0VyUqmGhL38UnBJf=s176-c-k-c0x00ffffff-no-rj,False,False,1669908457.941395
Ugxq9-YiPy08Ryw0UYZ4AaABAg,Freddy Got Fingered (2001),12 days ago,Kevin Hawkins,UC5cX0Nb_xdWHnee7iOF-7fw,5,https://yt3.ggpht.com/ytc/AMLnZu83GklBrQWpHtbGvqkss9DtxYZnILU5ZUzp9g=s176-c-k-c0x00ffffff-no-rj,False,False,1669908457.942397
UgzHZoELJ18OzO0vMWF4AaABAg,No ACO and both Godfatties,12 days ago,Just Walt,UCuwmV6zCVyPbWb0DYnODkEg,0,https://yt3.ggpht.com/ytc/AMLnZu-ZoHW2Jr0l-WTWcj4PLZf6Ss8xn9XrI50QFg=s176-c-k-c0x00ffffff-no-rj,False,False,1669908457.943396
UgxZkMy5TYQO0I1LbLJ4AaABAg,"Not bad, 7 should prob be 1 and The Lord of the Rings while a good popular choice, shouldn't be in the top 10.",12 days ago,Sean Smylie,UCYj5-_ddWTdR7JiLlrsKpew,0,https://yt3.ggpht.com/ytc/AMLnZu-DWJwn0FDO6B6_FS4HellYzPVxefhx-SaqtA=s176-c-k-c0x00ffffff-no-rj,False,False,1669908457.945395
UgwSobz8S12hhW4ghD54AaABAg,Great list! Excited to the ones on the list that I haven't watched.,12 days ago,Zvonimir Brekalo,UC0-486lUSr3XNQJQn35lZnw,2,https://yt3.ggpht.com/ytc/AMLnZu8Pv9KJCRkNunZNE1K17How53c1lLGFY7UeeA=s176-c-k-c0x00ffffff-no-rj,False,False,1669908457.945395
UgxiG7ISTSu5q4ryDdB4AaABAg,"This is just a list of ""The Room"" 30 times.",12 days ago,ᛞᛖᚾᚾᛁᛋ ᛏᚱᛟᚹᚨᛏᛟ,UCBwUg4S7XRhnnMkO6UbqPRg,52,https://yt3.ggpht.com/ytc/AMLnZu-HiUqJL7cRohMmVE6k3jV6hziVvQcIUzMr28n98w=s176-c-k-c0x00ffffff-no-rj,False,False,1669908457.947396
